{
  "$schema": "https://json-schema.org/draft/2020-12/schema",
  "$id": "urn:openehr:cnf:schema:statement:0.1.0",
  "title": "CNF 2.0 party statement (ICS + SDoC)",
  "description": "The supplier's Implementation Conformance Statement (the verdict-bearing claims) plus the SDoC self-declaration. The canonical JSON interchange artifact the verdict machinery consumes; verdicts are computed from it, never asserted here.",
  "type": "object",
  "additionalProperties": false,
  "required": [
    "product",
    "schedule_release",
    "claims"
  ],
  "properties": {
    "product": {
      "type": "object",
      "additionalProperties": false,
      "required": [
        "name",
        "version",
        "vendor",
        "identifier"
      ],
      "properties": {
        "name": {
          "type": "string",
          "minLength": 1
        },
        "version": {
          "type": "string",
          "minLength": 1
        },
        "vendor": {
          "type": "string",
          "minLength": 1
        },
        "identifier": {
          "type": "string",
          "minLength": 1
        }
      }
    },
    "schedule_release": {
      "type": "string",
      "minLength": 1
    },
    "spec_versions": {
      "type": "object",
      "additionalProperties": false,
      "properties": {
        "rm": {
          "type": "string"
        },
        "base": {
          "type": "string"
        },
        "am": {
          "type": "string"
        },
        "aql": {
          "type": "string"
        },
        "its_rest": {
          "type": "string"
        },
        "term": {
          "type": "string"
        }
      }
    },
    "claims": {
      "type": "object",
      "additionalProperties": false,
      "properties": {
        "capabilities": {
          "type": "array",
          "items": {
            "type": "string",
            "pattern": "^[A-Za-z_][A-Za-z0-9_]*$"
          }
        },
        "profiles": {
          "type": "array",
          "items": {
            "enum": [
              "CORE",
              "STANDARD",
              "OPTIONS",
              "SEC-BASIC",
              "D",
              "M",
              "X"
            ]
          }
        }
      }
    },
    "tech_profiles": {
      "type": "array",
      "items": {
        "type": "object",
        "additionalProperties": false,
        "required": [
          "its"
        ],
        "properties": {
          "its": {
            "enum": [
              "its-rest"
            ]
          },
          "formats": {
            "type": "array",
            "items": {
              "enum": [
                "canonical-json",
                "canonical-xml",
                "wt-flat",
                "wt-structured",
                "wt"
              ]
            }
          }
        }
      }
    },
    "options": {
      "type": "array",
      "items": {
        "type": "string",
        "pattern": "^[a-z0-9_-]+$"
      }
    },
    "performance": {
      "type": "object",
      "additionalProperties": false,
      "required": [
        "class",
        "environment_ref"
      ],
      "properties": {
        "class": {
          "type": "string",
          "minLength": 1
        },
        "environment_ref": {
          "type": "string",
          "minLength": 1
        }
      }
    },
    "non_functional": {
      "type": "object"
    },
    "evidence": {
      "type": "array",
      "items": {
        "type": "object",
        "additionalProperties": false,
        "required": [
          "results_path",
          "sha256"
        ],
        "properties": {
          "results_path": {
            "type": "string",
            "minLength": 1
          },
          "sha256": {
            "type": "string",
            "minLength": 1
          }
        }
      }
    },
    "attestation": {
      "type": "object",
      "additionalProperties": false,
      "required": [
        "signatory",
        "role",
        "date",
        "statement"
      ],
      "properties": {
        "signatory": {
          "type": "string",
          "minLength": 1
        },
        "role": {
          "type": "string",
          "minLength": 1
        },
        "date": {
          "type": "string",
          "minLength": 1
        },
        "statement": {
          "type": "string",
          "minLength": 1
        }
      }
    }
  }
}
