{
  "product": {
    "name": "EHRbase",
    "version": "2.34.0",
    "vendor": "EHRbase (vitagroup / upstream open-source project)",
    "identifier": "urn:ehrbase:ehrbase"
  },
  "schedule_release": "cnf-2.0-w2",
  "spec_versions": {
    "rm": "1.1.0",
    "base": "1.2.0",
    "term": "3.0.0",
    "aql": "1.1.0",
    "its_rest": "1.0.3"
  },
  "claims": {
    "capabilities": [
      "Adl14ArchetypeProvisioning",
      "Adl14OptProvisioning",
      "TemplateExamples",
      "QueryProvisioning",
      "EhrOperations",
      "EhrStatus",
      "CompositionOps",
      "DirectoryOps",
      "ChangeSets",
      "Versioning",
      "ArchetypeValidation",
      "AqlBasic",
      "AqlAdvanced",
      "PhysicalDeletion",
      "EhrApi",
      "DefinitionApi",
      "QueryApi",
      "AdminApi",
      "EhrDemographicSeparation",
      "AuthenticatedAccess",
      "AuthorizationSeparation"
    ],
    "profiles": [
      "CORE",
      "STANDARD"
    ]
  },
  "tech_profiles": [
    {
      "its": "its-rest",
      "formats": [
        "canonical-json",
        "canonical-xml"
      ]
    }
  ],
  "options": [
    "contribution-xml-unsupported",
    "directory-empty-error",
    "directory-xml-supported",
    "ehr-status-xml-supported",
    "ehr-xml-supported"
  ],
  "non_functional": {
    "note": "First-cut ICS for the CNF comparison re-base (#232), derived from the EHRbase 2.x documented surface: ADL 1.4 OPT provisioning only (no ADL 2 endpoints), no demographic/messaging/EHR-extract services, Basic auth with one clinical + one admin principal (no readonly role \u2014 the ixit declares no readonly instance), SimplifiedFormats UNCLAIMED: measured 2026-07-22, the /openehr/v1 composition endpoint answers 415 to the ITS-REST 1.1.0 media types (application/openehr.wt.flat+json / wt.structured+json) and accepts only the deprecated .schema+json names \u2014 the ITS-REST simplified wire is not implemented. Option selection (directory-empty-error) is configuration-pinned by docker/sut-ehrbase-java.yml, as is SYSTEM_ALLOWTEMPLATEOVERWRITE=false \u2014 no longer an option selection since the 2026-07-28 re-adjudication of AMB-4 made the duplicate-template 409 a gating expectation for every server, but still the setting this SUT needs in order to meet it. The canonical-XML family options (AMB-167) carry forward the posture this ICS already implied before those rows became option-gated \u2014 the EHR / EHR_STATUS / directory XML rows were judged as served and the CONTRIBUTION read rows as refused \u2014 with no new claim made; the party family is not declared because PartyOperations is not claimed. Every claim is refined by the measured run \u2014 the published verdicts, not this file, are the record."
  },
  "evidence": []
}
